<?xml version="1.0" encoding="UTF-8"?>
<!DOCTYPE menu:menubar PUBLIC "-//OpenOffice.org//DTD OfficeDocument 1.0//EN" "menubar.dtd">
<menu:menubar xmlns:menu="http://openoffice.org/2001/menu" menu:id="menubar">
 <menu:menu menu:id=".uno:PickList" menu:label="">
  <menu:menupopup>
   <menu:menuitem menu:id=".uno:AddDirect"/>
   <menu:menuitem menu:id=".uno:Open"/>
   <menu:menuitem menu:id=".uno:RecentFileList"/>
   <menu:menuitem menu:id=".uno:CloseDoc"/>
   <menu:menuseparator/>
   <menu:menuitem menu:id=".uno:SaveAs"/>
   <menu:menuseparator/>
   <menu:menuitem menu:id=".uno:Reload"/>
   <menu:menuseparator/>
   <menu:menu menu:id=".uno:SendToMenu" menu:label="">
    <menu:menupopup>
     <menu:menuitem menu:id=".uno:SendMail"/>
    </menu:menupopup>
   </menu:menu>
   <menu:menuseparator/>
   <menu:menuitem menu:id=".uno:PrintPreview"/>
   <menu:menuitem menu:id=".uno:Print"/>
   <menu:menuitem menu:id=".uno:Quit"/> 
  </menu:menupopup>
 </menu:menu>
 <menu:menu menu:id=".uno:EditMenu" menu:label="">
  <menu:menupopup>
   <menu:menuitem menu:id=".uno:Undo"/>
   <menu:menuitem menu:id=".uno:Redo"/>
   <menu:menuitem menu:id=".uno:Repeat"/>
   <menu:menuseparator/>
   <menu:menuitem menu:id=".uno:Cut"/>
   <menu:menuitem menu:id=".uno:Copy"/>
   <menu:menuitem menu:id=".uno:Paste"/>
   <menu:menuitem menu:id=".uno:SelectAll"/>
   <menu:menuseparator/>
   <menu:menuitem menu:id=".uno:SearchDialog"/>
  </menu:menupopup>
 </menu:menu>
 <menu:menu menu:id=".uno:ViewMenu" menu:label="">
  <menu:menupopup>
   <menu:menuitem menu:id=".uno:PrintLayout"/>
   <menu:menuseparator/>
   <menu:menuitem menu:id=".uno:AvailableToolbars"/>
   <menu:menuitem menu:id=".uno:StatusBarVisible"/>
   <menu:menuitem menu:id=".uno:Ruler"/>
   <menu:menuseparator/>
   <menu:menuitem menu:id=".uno:ControlCodes"/>
   <menu:menuitem menu:id=".uno:ShowAnnotations"/>
   <menu:menuseparator/>
   <menu:menuitem menu:id=".uno:Zoom"/>
   <menu:menuseparator/>
   <menu:menu menu:id=".uno:ChangeUserLevel" menu:label="">
    <menu:menupopup>
     <menu:menuitem menu:id=".uno:SetUserLevelBeginner"/>
     <menu:menuitem menu:id=".uno:SetUserLevelAverage"/>
     <menu:menuitem menu:id=".uno:SetUserLevelExpert"/>
    </menu:menupopup>
   </menu:menu>
  </menu:menupopup>
 </menu:menu>
 <menu:menu menu:id=".uno:InsertMenu" menu:label="">
  <menu:menupopup>
   <menu:menuitem menu:id=".uno:InsertBreak"/>
   <menu:menu menu:id=".uno:FieldMenu" menu:label="">
    <menu:menupopup>
     <menu:menuitem menu:id=".uno:InsertDateField"/>
     <menu:menuitem menu:id=".uno:InsertTimeField"/>
     <menu:menuitem menu:id=".uno:InsertPageNumberField"/>
     <menu:menuitem menu:id=".uno:InsertPageCountField"/>
     <menu:menuitem menu:id=".uno:InsertTitleField"/>
     <menu:menuitem menu:id=".uno:InsertAuthorField"/>
     <menu:menuseparator/>
     <menu:menuitem menu:id=".uno:InsertField"/>
    </menu:menupopup>
   </menu:menu>
   <menu:menuitem menu:id=".uno:InsertSymbol"/>
   <menu:menuseparator/>
   <menu:menuitem menu:id=".uno:InsertPageHeader"/>
   <menu:menuitem menu:id=".uno:InsertPageFooter"/>
   <menu:menuseparator/>
   <menu:menuitem menu:id=".uno:InsertObjectStarMath"/>
   <menu:menuitem menu:id=".uno:InsertGraphic"/>
   <menu:menuitem menu:id=".uno:InsertAVMedia"/>
   <menu:menu menu:id=".uno:ObjectMenu" menu:label="">
    <menu:menupopup>
     <menu:menuitem menu:id=".uno:InsertObject"/>
     <menu:menuitem menu:id=".uno:InsertPlugin"/>
     <menu:menuitem menu:id=".uno:InsertObjectChart"/>
    </menu:menupopup>
   </menu:menu>
   <menu:menuseparator/>
   <menu:menuitem menu:id=".uno:InsertDoc"/>
  </menu:menupopup>
 </menu:menu>
 <menu:menu menu:id=".uno:FormatMenu" menu:label="">
  <menu:menupopup>
   <menu:menuitem menu:id=".uno:ResetAttributes"/>
   <menu:menuseparator/>
   <menu:menuitem menu:id=".uno:FontDialog"/>
   <menu:menuitem menu:id=".uno:ParagraphDialog"/>
   <menu:menuitem menu:id=".uno:PageDialog"/>
   <menu:menuseparator/>
   <menu:menu menu:id=".uno:TransliterateMenu" menu:label="">
    <menu:menupopup>
     <menu:menuitem menu:id=".uno:ChangeCaseToUpper"/>
     <menu:menuitem menu:id=".uno:ChangeCaseToLower"/>
    </menu:menupopup>
   </menu:menu>
   <menu:menuitem menu:id=".uno:FormatColumns"/>
   <menu:menuseparator/>
   <menu:menuitem menu:id=".uno:DesignerDialog"/>
   <menu:menuseparator/>
   <menu:menu menu:id=".uno:ObjectAlign" menu:label="">
    <menu:menupopup>
     <menu:menuitem menu:id=".uno:CommonAlignLeft"/>
     <menu:menuitem menu:id=".uno:CommonAlignHorizontalCenter"/>
     <menu:menuitem menu:id=".uno:CommonAlignRight"/>
     <menu:menuitem menu:id=".uno:CommonAlignJustified"/>
     <menu:menuseparator/>
     <menu:menuitem menu:id=".uno:CommonAlignTop"/>
     <menu:menuitem menu:id=".uno:CommonAlignVerticalCenter"/>
     <menu:menuitem menu:id=".uno:CommonAlignBottom"/>
    </menu:menupopup>
   </menu:menu>
   <menu:menuseparator/>
   <menu:menuitem menu:id=".uno:GraphicDialog"/>
  </menu:menupopup>
 </menu:menu>
 <menu:menu menu:id=".uno:ToolsMenu" menu:label="">
  <menu:menupopup>
   <menu:menuitem menu:id=".uno:SpellingAndGrammarDialog"/>
   <menu:menuseparator/>
   <menu:menuitem menu:id=".uno:ChapterNumberingDialog"/>
   <menu:menuitem menu:id=".uno:LineNumberingDialog"/>
   <menu:menuseparator/>
   <menu:menuitem menu:id=".uno:Gallery"/>
   <menu:menuseparator/>
   <menu:menu menu:id=".uno:UpdateMenu" menu:label="">
    <menu:menupopup>
     <menu:menuitem menu:id=".uno:UpdateAll"/>
    </menu:menupopup>
   </menu:menu>
   <menu:menuseparator/>
   <menu:menuitem menu:id=".uno:AutoCorrectDlg"/>
   <menu:menu menu:id=".uno:ScriptOrganizer"/>
   <menu:menuitem menu:id=".uno:ConfigureDialog"/>
   <menu:menuitem menu:id=".uno:OptionsTreeDialog"/>
  </menu:menupopup>
 </menu:menu>
 <menu:menu menu:id=".uno:WindowList" menu:label="">
  <menu:menupopup>
   <menu:menuitem menu:id=".uno:NewWindow"/>
   <menu:menuitem menu:id=".uno:CloseWin"/>
   <menu:menuseparator/>
  </menu:menupopup>
 </menu:menu>
 <menu:menu menu:id=".uno:HelpMenu" menu:label="">
  <menu:menupopup>
   <menu:menuitem menu:id=".uno:HelpIndex"/>
   <menu:menuitem menu:id=".uno:ExtendedHelp"/>
   <menu:menuitem menu:id=".uno:About"/>
   <menu:menuitem menu:id=".uno:ShowLicense"/>
  </menu:menupopup>
 </menu:menu>
</menu:menubar>
