<?xml version="1.0" encoding="UTF-8"?>
<!DOCTYPE menu:menubar PUBLIC "-//OpenOffice.org//DTD OfficeDocument 1.0//EN" "menubar.dtd">
<menu:menubar xmlns:menu="http://openoffice.org/2001/menu" menu:id="menubar">
 <menu:menu menu:id=".uno:PickList" menu:label="">
  <menu:menupopup>
   <menu:menuitem menu:id=".uno:AddDirect"/>
   <menu:menuitem menu:id=".uno:Open"/>
   <menu:menuitem menu:id=".uno:RecentFileList"/>
   <menu:menuseparator/>
   <menu:menuitem menu:id=".uno:CloseDoc"/>
   <menu:menuitem menu:id=".uno:SaveAs"/>
   <menu:menuseparator/>
   <menu:menuitem menu:id=".uno:Reload"/>
   <menu:menuseparator/>
   <menu:menuitem menu:id=".uno:ExportTo"/>
   <menu:menuitem menu:id=".uno:ExportToPDF"/>
   <menu:menuseparator/>
   <menu:menuitem menu:id=".uno:PrintPreview"/>
   <menu:menuitem menu:id=".uno:Print"/>
   <menu:menuitem menu:id=".uno:Quit"/>
  </menu:menupopup>
 </menu:menu>
 <menu:menu menu:id=".uno:EditMenu" menu:label="">
  <menu:menupopup>
   <menu:menuitem menu:id=".uno:Undo"/>
   <menu:menuitem menu:id=".uno:Redo"/>
   <menu:menuitem menu:id=".uno:Repeat"/>
   <menu:menuseparator/>
   <menu:menuitem menu:id=".uno:Cut"/>
   <menu:menuitem menu:id=".uno:Copy"/>
   <menu:menuitem menu:id=".uno:Paste"/>
   <menu:menuitem menu:id=".uno:PasteSpecial"/>
   <menu:menuitem menu:id=".uno:SelectAll"/>
   <menu:menuseparator/>
   <menu:menuitem menu:id=".uno:EditHeaderAndFooter"/>
   <menu:menuseparator/>
   <menu:menuitem menu:id=".uno:Delete"/>
   <menu:menuitem menu:id=".uno:DeleteCell"/>
   <menu:menu menu:id=".uno:EditSheetMenu" menu:label="">
    <menu:menupopup>
     <menu:menuitem menu:id=".uno:Move"/>
     <menu:menuitem menu:id=".uno:SelectTables"/>
     <menu:menuitem menu:id=".uno:Remove"/>
    </menu:menupopup>
   </menu:menu>
   <menu:menuseparator/>
   <menu:menuitem menu:id=".uno:ImageMapDialog"/>
   <menu:menuitem menu:id=".uno:ObjectMenue"/>
  </menu:menupopup>
 </menu:menu>
 <menu:menu menu:id=".uno:ViewMenu" menu:label="">
  <menu:menupopup>
   <menu:menuitem menu:id=".uno:NormalViewMode"/>
   <menu:menuitem menu:id=".uno:PagebreakMode"/>
   <menu:menuseparator/>
   <menu:menuitem menu:id=".uno:AvailableToolbars"/>
   <menu:menuitem menu:id=".uno:InputLineVisible"/>
   <menu:menuitem menu:id=".uno:StatusBarVisible"/>
   <menu:menuitem menu:id=".uno:ShowImeStatusWindow"/>
   <menu:menuseparator/>
   <menu:menuitem menu:id=".uno:ViewRowColumnHeaders"/>
   <menu:menuseparator/>
   <menu:menu menu:id=".uno:ChangeUserLevel" menu:label="">
    <menu:menupopup>
     <menu:menuitem menu:id=".uno:SetUserLevelBeginner"/>
     <menu:menuitem menu:id=".uno:SetUserLevelAverage"/>
     <menu:menuitem menu:id=".uno:SetUserLevelExpert"/>
    </menu:menupopup>
   </menu:menu>
  </menu:menupopup>
 </menu:menu>
 <menu:menu menu:id=".uno:InsertMenu" menu:label="">
  <menu:menupopup>
   <menu:menu menu:id=".uno:InsertBreakMenu" menu:label="">
    <menu:menupopup>
     <menu:menuitem menu:id=".uno:InsertRowBreak"/>
     <menu:menuitem menu:id=".uno:InsertColumnBreak"/>
    </menu:menupopup>
   </menu:menu>
   <menu:menuitem menu:id=".uno:InsertCell"/>
   <menu:menuitem menu:id=".uno:InsertRows"/>
   <menu:menuitem menu:id=".uno:InsertColumns"/>
   <menu:menuitem menu:id=".uno:Insert"/>
   <menu:menuitem menu:id=".uno:InsertSymbol"/>
   <menu:menuseparator/>
   <menu:menuitem menu:id=".uno:FunctionDialog"/>
   <menu:menuitem menu:id=".uno:FunctionBox"/>
   <menu:menuseparator/>
   <menu:menuitem menu:id=".uno:InsertAnnotation"/>
   <menu:menuseparator/>
   <menu:menuitem menu:id=".uno:InsertObjectChart"/>
  </menu:menupopup>
 </menu:menu>
 <menu:menu menu:id=".uno:FormatMenu" menu:label="">
  <menu:menupopup>
   <menu:menuitem menu:id=".uno:FormatCellDialog"/>
   <menu:menu menu:id=".uno:RowMenu" menu:label="">
    <menu:menupopup>
     <menu:menuitem menu:id=".uno:RowHeight"/>
     <menu:menuitem menu:id=".uno:SetOptimalRowHeight"/>
     <menu:menuitem menu:id=".uno:HideRow"/>
     <menu:menuitem menu:id=".uno:ShowRow"/>
    </menu:menupopup>
   </menu:menu>
   <menu:menu menu:id=".uno:ColumnMenu" menu:label="">
    <menu:menupopup>
     <menu:menuitem menu:id=".uno:ColumnWidth"/>
     <menu:menuitem menu:id=".uno:SetOptimalColumnWidth"/>
     <menu:menuitem menu:id=".uno:HideColumn"/>
     <menu:menuitem menu:id=".uno:ShowColumn"/>
    </menu:menupopup>
   </menu:menu>
   <menu:menu menu:id=".uno:SheetMenu" menu:label="">
    <menu:menupopup>
     <menu:menuitem menu:id=".uno:RenameTable"/>
     <menu:menuitem menu:id=".uno:Hide"/>
     <menu:menuitem menu:id=".uno:Show"/>
     <menu:menuitem menu:id=".uno:SheetRightToLeft"/>
    </menu:menupopup>
   </menu:menu>
   <menu:menuitem menu:id=".uno:ToggleMergeCells"/>
   <menu:menuseparator/>
   <menu:menuitem menu:id=".uno:PageFormatDialog"/>
   <menu:menuseparator/>
   <menu:menu menu:id=".uno:TransliterateMenu" menu:label="">
    <menu:menupopup>
     <menu:menuitem menu:id=".uno:ChangeCaseToUpper"/>
     <menu:menuitem menu:id=".uno:ChangeCaseToLower"/>
     <menu:menuitem menu:id=".uno:ChangeCaseToHalfWidth"/>
     <menu:menuitem menu:id=".uno:ChangeCaseToFullWidth"/>
     <menu:menuitem menu:id=".uno:ChangeCaseToHiragana"/>
     <menu:menuitem menu:id=".uno:ChangeCaseToKatakana"/>
    </menu:menupopup>
   </menu:menu>
   <menu:menu menu:id=".uno:ObjectAlign" menu:label="">
    <menu:menupopup>
     <menu:menuitem menu:id=".uno:CommonAlignHorizontalDefault"/>
     <menu:menuitem menu:id=".uno:CommonAlignLeft"/>
     <menu:menuitem menu:id=".uno:CommonAlignHorizontalCenter"/>
     <menu:menuitem menu:id=".uno:CommonAlignRight"/>
     <menu:menuitem menu:id=".uno:CommonAlignJustified"/>
     <menu:menuseparator/>
     <menu:menuitem menu:id=".uno:CommonAlignTop"/>
     <menu:menuitem menu:id=".uno:CommonAlignVerticalCenter"/>
     <menu:menuitem menu:id=".uno:CommonAlignBottom"/>
    </menu:menupopup>
   </menu:menu>
  </menu:menupopup>
 </menu:menu>
 <menu:menu menu:id=".uno:ToolsMenu" menu:label="">
  <menu:menupopup>
   <menu:menuseparator/>
   <menu:menu menu:id=".uno:CellContentsMenu" menu:label="">
    <menu:menupopup>
     <menu:menuitem menu:id=".uno:Calculate"/>
     <menu:menuitem menu:id=".uno:AutomaticCalculation"/>
     <menu:menuseparator/>
     <menu:menuitem menu:id=".uno:AutoComplete"/>
    </menu:menupopup>
   </menu:menu>
   <menu:menuseparator/>
   <menu:menuitem menu:id=".uno:ConfigureDialog"/>
   <menu:menuitem menu:id=".uno:OptionsTreeDialog"/>
  </menu:menupopup>
 </menu:menu>
 <menu:menu menu:id=".uno:DataMenu" menu:label="">
  <menu:menupopup>
   <menu:menuitem menu:id=".uno:DefineDBName"/>
   <menu:menuitem menu:id=".uno:SelectDB"/>
   <menu:menuitem menu:id=".uno:DataSort"/>
   <menu:menuseparator/>
   <menu:menuitem menu:id=".uno:TextToColumns"/>
   <menu:menuseparator/>
   <menu:menuitem menu:id=".uno:DataAreaRefresh"/>
  </menu:menupopup>
 </menu:menu>
 <menu:menu menu:id=".uno:WindowList" menu:label="">
  <menu:menupopup>
   <menu:menuitem menu:id=".uno:NewWindow"/>
   <menu:menuitem menu:id=".uno:CloseWin"/>
   <menu:menuseparator/>
   <menu:menuitem menu:id=".uno:SplitWindow"/>
   <menu:menuitem menu:id=".uno:FreezePanes"/>
  </menu:menupopup>
 </menu:menu>
 <menu:menu menu:id=".uno:HelpMenu" menu:label="">
  <menu:menupopup>
   <menu:menuitem menu:id=".uno:HelpIndex"/>
   <menu:menuitem menu:id=".uno:ExtendedHelp"/>
   <menu:menuitem menu:id=".uno:About"/>
   <menu:menuitem menu:id=".uno:ShowLicense"/>
  </menu:menupopup>
 </menu:menu>
</menu:menubar>